{
  "built_at": "2026-10-19",
  "endpoint_is_not_origin": true,
  "entities": [
    {
      "admission": "DNS/routing candidate only; origin and site identity remain unknown.",
      "assessment": "Provider documents Russian cash offices and a public WebSocket endpoint; these identify business presence and an endpoint, not compute facilities.",
      "entity_id": "application:entity:abcex",
      "facility_record_id": null,
      "name": "ABCEX",
      "origin_country_code": null,
      "provider_declared_hosting": null,
      "service_status": {
        "current_operation_verified": false,
        "reported_at": null,
        "status": "unverified"
      },
      "sources": [
        {
          "raw_source_ref": "data/raw/crypto/abcex-api.20261019.html",
          "retrieved_at": "2026-10-19",
          "source_published_at": null,
          "source_sha256": "289a18fbd23ee10062caf86ba33a09352e8a70ec75d8a9d713cc0576ca4af520",
          "source_updated_at": null,
          "source_url": "https://abcex.io/documentation/en/api-keys.html"
        },
        {
          "raw_source_ref": "data/raw/crypto/abcex-api-intro.20261019.html",
          "retrieved_at": "2026-10-19",
          "source_published_at": null,
          "source_sha256": "2f4bd96f9b62f23cd9eae48e349411d4c1df202f1e24461410050dc16d45e868",
          "source_updated_at": "2026-05-04",
          "source_url": "https://abcex.readme.io/reference/intro"
        },
        {
          "raw_source_ref": "data/raw/crypto/abcex-offices.20261019.html",
          "retrieved_at": "2026-10-19",
          "source_published_at": null,
          "source_sha256": "ae338fe88631dc492021b6421765b4565af5240e2950d3e86e7165eb84e5c58c",
          "source_updated_at": null,
          "source_url": "https://abcex.io/documentation/en/cash.html"
        }
      ]
    },
    {
      "admission": "Use as a non-RU comparison and customer/cloud relationship, not as a new owned facility.",
      "assessment": "The operator API FAQ declares Singapore hosting; observed production API CNAMEs point to CloudFront names.",
      "entity_id": "application:entity:bybit",
      "facility_record_id": null,
      "name": "Bybit",
      "origin_country_code": null,
      "provider_declared_hosting": {
        "availability_zone_ids": [
          "apse1-az2",
          "apse1-az3"
        ],
        "cloud_provider": "AWS",
        "country_code": "SG",
        "endpoint_to_zone_mapping_asserted": false,
        "source": {
          "raw_source_ref": "data/raw/crypto/bybit-api-faq.20261019.html",
          "retrieved_at": "2026-10-19",
          "source_published_at": null,
          "source_sha256": "860b9f35eca617992855ed556474a254fc845b7d68e7e548d78d2d2c369c58c3",
          "source_updated_at": null,
          "source_url": "https://bybit-exchange.github.io/docs/faq"
        }
      },
      "service_status": {
        "current_operation_verified": false,
        "reported_at": null,
        "status": "unverified"
      },
      "sources": [
        {
          "raw_source_ref": "data/raw/crypto/bybit-api-faq.20261019.html",
          "retrieved_at": "2026-10-19",
          "source_published_at": null,
          "source_sha256": "860b9f35eca617992855ed556474a254fc845b7d68e7e548d78d2d2c369c58c3",
          "source_updated_at": null,
          "source_url": "https://bybit-exchange.github.io/docs/faq"
        }
      ]
    },
    {
      "admission": "Dated service-status and endpoint evidence; apply only to EXMO.me, not similarly named entities.",
      "assessment": "Operator announced termination and liquidation. Continued website DNS answers do not establish active trading or recovered service.",
      "entity_id": "application:entity:exmo-me",
      "facility_record_id": null,
      "name": "EXMO.me",
      "origin_country_code": null,
      "provider_declared_hosting": null,
      "service_status": {
        "current_operation_verified": false,
        "reported_at": "2026-07-24",
        "status": "termination_announced"
      },
      "sources": [
        {
          "raw_source_ref": "data/raw/crypto/exmo-me-closure.20261019.html",
          "retrieved_at": "2026-10-19",
          "source_published_at": "2026-07-24",
          "source_sha256": "7d3fbf4eeda6d51943c2878b2fbe923a09a0339182cabc3626e693c0f256d2cb",
          "source_updated_at": null,
          "source_url": "https://exmo.me/blog/uvedomleniya/termination-and-liquidation"
        }
      ]
    },
    {
      "admission": "Historical event and attributed entity evidence only. Keep law-enforcement jurisdiction separate from server geography.",
      "assessment": "DOJ reports March 2025 domain seizures and server seizures by German and Finnish authorities; Treasury describes Russian operations. Neither establishes current Russian physical hosting.",
      "entity_id": "application:entity:garantex",
      "facility_record_id": null,
      "name": "Garantex",
      "origin_country_code": null,
      "provider_declared_hosting": null,
      "service_status": {
        "current_operation_verified": false,
        "reported_at": "2025-03-07",
        "status": "historical_seizure_reported"
      },
      "sources": [
        {
          "raw_source_ref": "data/raw/crypto/garantex-doj.20261019.html",
          "retrieved_at": "2026-10-19",
          "source_published_at": "2025-03-07",
          "source_sha256": "75a7704a0ece665ad707a84758ad526d62fc762c6720dafbbf6acd5f1cfbd02a",
          "source_updated_at": "2025-04-25",
          "source_url": "https://www.justice.gov/opa/pr/garantex-cryptocurrency-exchange-disrupted-international-operation"
        },
        {
          "raw_source_ref": "data/raw/crypto/grinex-treasury.20261019.html",
          "retrieved_at": "2026-10-19",
          "source_published_at": "2025-08-14",
          "source_sha256": "e8f39321db35ef8ec3ab5880038efc8548834625dbc721b3669c3b3a789bfe4a",
          "source_updated_at": null,
          "source_url": "https://home.treasury.gov/news/press-releases/sb0225"
        }
      ]
    },
    {
      "admission": "Re-verify operator/domain identity before collecting endpoints; do not inherit Garantex locations.",
      "assessment": "Treasury's August 2025 release describes a successor relationship to Garantex. Current domain-to-operator identity and hosting were not established in this review.",
      "entity_id": "application:entity:grinex",
      "facility_record_id": null,
      "name": "Grinex",
      "origin_country_code": null,
      "provider_declared_hosting": null,
      "service_status": {
        "current_operation_verified": false,
        "reported_at": null,
        "status": "unverified"
      },
      "sources": [
        {
          "raw_source_ref": "data/raw/crypto/grinex-treasury.20261019.html",
          "retrieved_at": "2026-10-19",
          "source_published_at": "2025-08-14",
          "source_sha256": "e8f39321db35ef8ec3ab5880038efc8548834625dbc721b3669c3b3a789bfe4a",
          "source_updated_at": null,
          "source_url": "https://home.treasury.gov/news/press-releases/sb0225"
        }
      ]
    }
  ],
  "excluded_from_location_and_network_totals": true,
  "records": [
    {
      "address_observations": [],
      "cnames": [],
      "confidence": "high",
      "dns_response": {
        "AD": false,
        "Authority": [
          {
            "TTL": 1800,
            "data": "ns1.ddos-guard.net. support.ddos-guard.net. 1789392389 10800 3600 604800 3600",
            "name": "exmo.me.",
            "type": 6
          }
        ],
        "CD": false,
        "Comment": "Response from 185.129.103.200.",
        "Question": [
          {
            "name": "exmo.me.",
            "type": 5
          }
        ],
        "RA": true,
        "RD": true,
        "Status": 0,
        "TC": false
      },
      "ecs_sent": false,
      "endpoint_role": "closure_notice_website",
      "entity_id": "application:entity:exmo-me",
      "facility_record_id": null,
      "hostname": "exmo.me",
      "measurement_vantage_country_code": null,
      "observed_at": "2026-10-19T14:52:52.947721+00:00",
      "origin_country_code": null,
      "origin_evidence": [],
      "query_result": "noerror_no_requested_rr",
      "record_id": "application:dns:3f8bce22cf9579085cda29c9",
      "resolver_url": "https://dns.google/resolve?name=exmo.me&type=CNAME",
      "rrtype": "CNAME",
      "source": {
        "raw_source_ref": "data/raw/crypto/endpoint-dns.20261019.json",
        "retrieved_at": "2026-10-19",
        "source_published_at": null,
        "source_sha256": "0091ffdef554a96e27a977dcfce335fb10a5fce31041924df8d80a632dbdb7ea",
        "source_updated_at": null,
        "source_url": "https://dns.google/resolve"
      },
      "source_json_pointer": "/records/14",
      "source_scope": "observed",
      "transport_error": null
    },
    {
      "address_observations": [],
      "cnames": [],
      "confidence": "high",
      "dns_response": {
        "AD": false,
        "Authority": [
          {
            "TTL": 1113,
            "data": "ns1.servicepipe.ru. support.servicepipe.ru. 2026052647 86400 900 691200 3600",
            "name": "abcex.io.",
            "type": 6
          }
        ],
        "CD": false,
        "Question": [
          {
            "name": "hub.abcex.io.",
            "type": 28
          }
        ],
        "RA": true,
        "RD": true,
        "Status": 0,
        "TC": false
      },
      "ecs_sent": false,
      "endpoint_role": "documented_websocket",
      "entity_id": "application:entity:abcex",
      "facility_record_id": null,
      "hostname": "hub.abcex.io",
      "measurement_vantage_country_code": null,
      "observed_at": "2026-10-19T14:52:51.673800+00:00",
      "origin_country_code": null,
      "origin_evidence": [],
      "query_result": "noerror_no_requested_rr",
      "record_id": "application:dns:44fabdc4f5d93bb9a769f0c4",